{
  "claim_id": "cho-2026-13pdo-titer",
  "citation": "Cho et al. (2026), systems metabolic engineering of Corynebacterium glutamicum for 1,3-propanediol production",
  "claim_text": "Bounded reconstruction target: reported 1,3-propanediol production result (141.5 g/L; 2.95 g/L/h).",
  "reported_value": 141.5,
  "unit": "g/L",
  "tolerance": null,
  "status": "PENDING",
  "dependencies": [
    {"id":"publication","kind":"assertion","required":true,"availability":"available","source":null,"sha256":null,"version":null,"notes":"Primary publication."},
    {"id":"source-data","kind":"source_observation","required":true,"availability":"unknown","source":null,"sha256":null,"version":null,"notes":"Acquire persistent source-data package and hash local research copy if licensing permits."},
    {"id":"genome-state","kind":"state","required":true,"availability":"unknown","source":null,"sha256":null,"version":null,"notes":"Resolve deposited genome accession/version."},
    {"id":"gem-state","kind":"state","required":true,"availability":"unknown","source":null,"sha256":null,"version":null,"notes":"Pin exact genome-scale model/code revision used for relevant inference."},
    {"id":"fermentation-state","kind":"state","required":true,"availability":"unknown","source":null,"sha256":null,"version":null,"notes":"Resolve strain and process state underlying bounded titer/productivity claim."},
    {"id":"claim-derivation","kind":"transformation","required":true,"availability":"unknown","source":null,"sha256":null,"version":null,"notes":"Trace source measurements to reported titer and productivity."}
  ],
  "findings": []
}
