{
  "claim_id": "decembrino-2021-dpt-titer-yield",
  "citation": "Decembrino et al. (2021), Synthesis of (−)-deoxypodophyllotoxin and (−)-epipodophyllotoxin via a multi-enzyme cascade in E. coli, Microbial Cell Factories 20:183, DOI 10.1186/s12934-021-01673-5",
  "claim_text": "Bounded reconstruction target: reported deoxypodophyllotoxin production of 196 µM (78 mg/L), corresponding to 98% theoretical yield from 200 µM matairesinol.",
  "reported_value": 78,
  "unit": "mg/L",
  "tolerance": null,
  "status": "INCONSISTENT",
  "dependencies": [
    {"id":"publication","kind":"assertion","required":true,"availability":"available","source":null,"sha256":null,"version":"2021-09-20 version of record","notes":"Primary open-access publication; DOI 10.1186/s12934-021-01673-5."},
    {"id":"supplementary-information","kind":"source_observation","required":true,"availability":"available","source":null,"sha256":null,"version":null,"notes":"Publisher supplementary PDF contains DNA sequences, plasmid information, LC/MS methods, qualitative references, quantitative-analysis formulas and supporting figures/tables."},
    {"id":"matairesinol-input-state","kind":"state","required":true,"availability":"available","source":null,"sha256":null,"version":null,"notes":"Reported substrate input is 200 µM matairesinol for the bounded conversion/yield claim."},
    {"id":"enzyme-construct-state","kind":"state","required":true,"availability":"available","source":null,"sha256":null,"version":null,"notes":"Manuscript and SI specify host, plasmid modules, enzyme variants and key expression/biotransformation conditions for the bounded cascade."},
    {"id":"dpt-identifier-state","kind":"identity","required":true,"availability":"available","source":null,"sha256":null,"version":null,"notes":"Main manuscript gives 2-ODD GenBank KT390173.1; SI labels the supplied 2-odd native DNA sequence as KT390173.12. This is recorded as an internal identifier inconsistency, not evidence of an incorrect sequence or biological result."},
    {"id":"lcms-source-observations","kind":"source_observation","required":true,"availability":"described_unavailable","source":null,"sha256":null,"version":null,"notes":"The public article/SI package describes LC/MS observations and shows selected chromatograms, but does not expose the underlying raw LC/MS/peak-area dataset needed to independently recompute the 196 µM value. The paper states raw data will be freely available to scientists for non-commercial use, indicating an on-request path rather than a public deposited dataset."},
    {"id":"internal-standard-calibration","kind":"transformation","required":true,"availability":"described_unavailable","source":null,"sha256":null,"version":null,"notes":"SI specifies 10–300 µM internal calibration using 200 µM sesamin but does not provide the calibration observations or fitted calibration parameters needed to independently derive 196 µM from instrument response in the public package."},
    {"id":"concentration-to-mass-conversion","kind":"transformation","required":true,"availability":"available","source":null,"sha256":null,"version":null,"notes":"Recomputed: 196 µmol/L × 398.40 g/mol = 78.0864 mg/L, consistent with reported 78 mg/L after rounding."},
    {"id":"yield-calculation","kind":"transformation","required":true,"availability":"available","source":null,"sha256":null,"version":null,"notes":"Recomputed: 196 µM / 200 µM × 100 = 98%, consistent with the reported theoretical yield under a 1:1 molar conversion assumption."}
  ],
  "findings": [
    {"test":"T1","result":"PASS","evidence":"The manuscript explicitly reports 196 µM (78 mg/L) deoxypodophyllotoxin and 98% yield from 200 µM matairesinol.","interpretation":"The bounded quantitative claim is identifiable without ambiguity."},
    {"test":"T2","result":"UNRESOLVED","evidence":"Raw LC/MS/peak-area observations and calibration observations/model parameters are not deposited in the audited public article/SI package.","interpretation":"The public evidence chain is not closed for independent reconstruction of the reported 196 µM concentration."},
    {"test":"T3","result":"FAIL","evidence":"Main manuscript: GenBank KT390173.1 for 2-ODD; SI: 'GenBank KT390173.12' for the native 2-odd sequence.","interpretation":"A versioned identifier inconsistency exists across publication artifacts. It is likely typographical but should be surfaced rather than silently normalized."},
    {"test":"T5","result":"UNRESOLVED","evidence":"The calibration range and internal standard are specified, but the public package lacks calibration measurements/fitted parameters linking instrument response to 196 µM.","interpretation":"The key quantitative transformation is described but cannot be replayed from public evidence alone."},
    {"test":"T6","result":"UNRESOLVED","evidence":"The downstream arithmetic reconstructs exactly (196 µM → 78.0864 mg/L; 196/200 → 98%), but the upstream derivation of 196 µM from analytical observations cannot be independently replayed from the public package.","interpretation":"The headline claim is partially reconstructable but not end-to-end reconstructable from public artifacts."}
  ]
}
